{
  "schema_version": "1.0",
  "id": "text-dev-clear-chinese-001",
  "kind": "text",
  "split": "dev",
  "languages": ["zh-CN"],
  "scenario_tags": ["clear-text", "chinese", "multiple-actions", "missing-optional-date"],
  "source": {
    "provenance": "synthetic",
    "creator": "SnapFlow fixture set",
    "license": "CC0-1.0",
    "source_url": null,
    "fixture_date": "2026-01-15",
    "contains_personal_data": false,
    "contains_confidential_data": false
  },
  "input": {
    "text": "产品演示会\n林悦在2026-01-22前整理演示脚本。\n陈浩检查移动端相机权限说明。",
    "locale": "zh-CN",
    "timezone": "Asia/Shanghai",
    "reference_date": "2026-01-15"
  },
  "gold": {
    "expected_action_count": 2,
    "actions": [
      {
        "id": "action-1",
        "title": "整理演示脚本",
        "owner": "林悦",
        "due": {
          "iso_date": "2026-01-22",
          "raw_text": "2026-01-22前",
          "resolution": "absolute"
        },
        "priority": "unknown",
        "evidence": [
          {
            "quote": "林悦在2026-01-22前整理演示脚本。",
            "start": 6,
            "end": 27
          }
        ]
      },
      {
        "id": "action-2",
        "title": "检查移动端相机权限说明",
        "owner": "陈浩",
        "due": null,
        "priority": "unknown",
        "evidence": [
          {
            "quote": "陈浩检查移动端相机权限说明。",
            "start": 28,
            "end": 42
          }
        ]
      }
    ],
    "clarifications": [],
    "forbidden_actions": [],
    "notes": "The second action has no date; absence alone should not force a clarification."
  }
}
